question_no,main_subject,sub_subject,question,optiona,optionb,optionc,optiond,correct_answer,difficulty,year,typeofpaper
222,Machine Learning,CNN,Consider one layer in CNN. Which layer type has the fewest parameters to be learned?,Convolutional layer with 10 filters (3×3),Fully connected layer,Convolutional layer with 8 filters (5×5),Max pooling layer,Max pooling layer,Medium,2020,ScientistEngineer SC Computer
223,Machine Learning,Regularization,Which of the following statements on regularization are true? I. Batch normalization has implicit regularization II. L2 gives Laplacian prior III. L2 gives Gaussian prior IV. Regularization factor may cause underfitting,I and IV,"I, III and IV",I and III,IV only,"I, III and IV",Medium,2020,ScientistEngineer SC Computer
224,Machine Learning,Logistic Regression,"The logit function L(x) = log(x/(1−x)). What is the range of L(x) for x ∈ (0,1)?","(0, ∞)","(0, 1)","(−∞, ∞)","(−∞, 0)","(−∞, ∞)",Easy,2020,ScientistEngineer SC Computer
225,Machine Learning,SVM,"In a Support Vector Machine with margin fixed to 1, the distance of support vectors from separating hyperplane is:",||W||,||W + b||,1/||W||,||W||²,1/||W||,Medium,2020,ScientistEngineer SC Computer
226,Machine Learning,Ensemble,The technique that combines the predictions from multiple machine learning algorithms together to make more accurate predictions than any individual model is called:,Reinforcement learning,Transfer learning,Ensemble learning,Inductive learning,Ensemble learning,Easy,2020,ScientistEngineer SC Computer
227,Machine Learning,Neural Networks,"Consider a single unit in a neural network that receives two binary inputs x1, x2 ∈ {0,1} and computes a linear combination followed by a threshold activation function. Given bias b = −5, the weights that allow computation of NAND function are:","w1 = 0, w2 = 0","w1 = 1, w2 = 1","w1 = −1, w2 = 1","w1 = −3, w2 = −3","w1 = −3, w2 = −3",Medium,2020,ScientistEngineer SC Computer
228,Machine Learning,Neural Networks,What is the main purpose of Dropout in a neural network architecture?,Reduce output dimensions,Prevent vanishing gradient,Prevent overfitting on training data,Increase learning rate,Prevent overfitting on training data,Easy,2020,ScientistEngineer SC Computer
229,Machine Learning,CNN,Which of the following statements about using convolutional layers instead of fully connected ones for visual tasks are TRUE? A. Reduce number of hidden layers B. Enable spatial context modelling C. Translation invariant D. Parameters increase E. Enable parameter sharing,All,"B, C, E","B, D, E","A, B, D, E","B, C, E",Medium,2020,ScientistEngineer SC Computer
230,Discrete Mathematics,Logic,"Let p ∈ {8,9,10,11,12}, q = not a composite number, r = a square number, s = a prime number. Evaluate ~((p − ~q) ∧ (~r ∨ ~s)).","{9,11}","{8,9,10,11,12}",{9},{11},{11},Medium,2020,ScientistEngineer SC Computer
231,Artificial Intelligence,Search,Which search uses problem-specific knowledge beyond the definition of the problem?,Informed search,Iterative deepening search,Both,Breadth-first search,Informed search,Easy,2020,ScientistEngineer SC Computer
232,Machine Learning,Backpropagation,Which of the following statements are true for benefits of using backpropagation algorithm to compute gradients?,Only I,II and III,I and IV,Only II,I and IV,Medium,2020,ScientistEngineer SC Computer
233,Machine Learning,KNN,"In terms of bias-variance decomposition, a 1-nearest neighbour classifier has ______ than a 3-nearest neighbour classifier.",Higher variance,Higher bias,Lower variance,Lower bias,Higher variance and lower bias,Medium,2020,ScientistEngineer SC Computer
234,Machine Learning,Bayesian Learning,"If the posterior distribution has the same distribution family as the prior, the term describing this condition is called:",Subjugate prior,Conjugate posterior,Conjugate prior,Alternate prior,Conjugate prior,Easy,2020,ScientistEngineer SC Computer
235,Machine Learning,Kernel Methods,"For feature map Φ(.) and kernel function k(Xi,Xj)=⟨Φ(Xi),Φ(Xj)⟩, which statements are true? I. Kernel trick avoids explicit computation of Φ(Xi) II. Running time does not depend on dimension of feature space",I only,II only,Both I and II,None,Both I and II,Medium,2020,ScientistEngineer SC Computer
236,Cryptography,RSA,"In RSA public key cryptosystem, which of the clauses are required for RSA to work?",I only,II only,IV only,I and III,I and III,Medium,2020,ScientistEngineer SC Computer
237,Mathematics,Number Theory,The remainder when 3^100000 is divided by 53 is:,1,2,5,28,1,Medium,2020,ScientistEngineer SC Computer
238,Cryptography,Digital Signature,Which of the following is NOT the aim of the Digital Signature scheme?,Authenticity,Non-repudiation,Confidentiality,Integrity,Confidentiality,Easy,2020,ScientistEngineer SC Computer
239,Security,Sandboxing,"In security, sandboxing is a mechanism used for:",Confidentiality,Authentication,Isolation,Non-repudiation,Isolation,Easy,2020,ScientistEngineer SC Computer
240,Computer Networks,Security,IPSec is designed to provide security at which layer of the protocol stack?,Application layer,Network layer,Data link layer,Physical layer,Network layer,Easy,2020,ScientistEngineer SC Computer
241,CSE,Software Engineering – SDLC Models,Which of the following is a Software Development Life Cycle Model,Data Warehouse,Data Model,Waterfall Model,Data Mart,Waterfall Model,Easy,2018,VSSC Technical Assistant (Computer Science)
242,CSE,Operating Systems,Which of the following is NOT a criterion for page replacement from main memory,First In First Out,Least Recently Used,Last In First Out,None of these,None of these,Medium,2018,VSSC Technical Assistant (Computer Science)
243,CSE,Computer Fundamentals – Character Encoding (ASCII),The ASCII code for character 'A' (Capital letter A) is,65,55,88,64,65,Easy,2018,VSSC Technical Assistant (Computer Science)
244,CSE,Operating Systems – I/O Management,Which of the following modes of I/O operation keeps the processor most busy,Programmed I/O,Interrupt Initiated I/O,DMA,None of these,Programmed I/O,Medium,2018,VSSC Technical Assistant (Computer Science)
245,CSE,Computer Organization & Architecture – Cache Memory Performance,The performance of cache memory is measured in terms of,Seek time,Access time,Hit ratio,Latency,Hit ratio,Medium,2018,VSSC Technical Assistant (Computer Science)
246,CSE,Programming – PHP Variables,Which prefix is used to denote a variable in PHP,$,@,~,#,$,Easy,2018,VSSC Technical Assistant (Computer Science)
247,CSE,Computer Organization & Architecture – Number Systems / BCD,,0000 1111,0001 0101,0011 0011,0000 1101,0001 0101,Easy,2018,VSSC Technical Assistant (Computer Science)
248,CSE,Computer Organization & Architecture – CISC Architecture,Which of the following is true about CISC architecture I. Large code size II. Reduced instruction set,Both I and II,Neither I Nor II,only I,only II,only I,Medium,2018,VSSC Technical Assistant (Computer Science)
249,CSE,OOP (Object-Oriented Programming) – Classes and Inheritance,A class which cannot be inherited is called,static class,template class,abstract class,final class,final class,Easy,2018,VSSC Technical Assistant (Computer Science)
250,CSE,Web Technology – CSS Basics,Which of the following is NOT true about Cascading Style Sheets (CSS)?,CSS can control the layout of multiple web pages,CSS supplements style formatting in HTML page,Style definitions can be saved in an external CSS file,Only one CSS can be used in a HTML file,Only one CSS can be used in a HTML file,Medium,2018,VSSC Technical Assistant (Computer Science)
251,CSE,Computer Networks – Internet Protocols / HTTP,Which is the default port number for H??? ?,25,22,80,53,80,Easy,2018,VSSC Technical Assistant (Computer Science)
252,CSE,Web Technology – AJAX,Which of the following is WRONG ?,AJAX stands for Asynchronous Javascript and HTML,AJAX is a client side script used to get data from server without refreshing the current page,AJAX is a scripting language,AJAX makes applications faster and more user friendly,AJAX is a scripting language,Medium,2018,VSSC Technical Assistant (Computer Science)
253,CSE,Web Technology – Number Systems / Codes,Which of the following are un-weighted code?,BCD,Hexadecimal,EBCDIC,Gray Code,Gray Code,Medium,2018,VSSC Technical Assistant (Computer Science)
254,CSE,Software Engineering – V-Model / Testing,"In the V model of software development, Integration Test Plan is prepared during which phase of software development",Coding,Design,Requirements,Software maintenance,Design,Medium,2018,VSSC Technical Assistant (Computer Science)
255,CSE,Computer Organization – Sequential Circuits / Flip-Flops,"In a positive edge triggered JK flip-flop, when J=0, K=1 and Q=0, what happens to Q when the clock input goes HIGH and what happens when the clock input goes LOW",Q becomes 0 when clock HIGH; Q becomes 0 when clock LOW,Q is RESET to 1 when clock LOW; Q unchanged when clock HIGH,Q is RESET to 1 when clock HIGH; Q unchanged when clock LOW,None of the above,Q is RESET to 1 when clock HIGH; Q unchanged when clock LOW,Hard,2018,VSSC Technical Assistant (Computer Science)
256,CSE,Computer Organization & Architecture – Digital Logic / Boolean Algebra,From the truth table given below write the Sum of Products (SOP) expression Input Output X Y Z P 0 0 0 0 0 0 1 1 0 1 0 0 0 1 1 1 1 0 0 0 1 0 1 0 1 1 0 1 1 1 1 0,P =XYZ + XYZ +XYZ,P= (X+Y+Z)(X+Y+Z)(X+Y+Z),not(XY)Z+not(X)YZ+Xynot(Z),None of the above,P =XYZ + XYZ +XYZ,Hard,2018,VSSC Technical Assistant (Computer Science)
257,CSE,Computer Networks/ Web Technology – HTTP Status Codes,The HTTP status code for requested resource not found is,400,405,404,500,404,Easy,2018,VSSC Technical Assistant (Computer Science)
258,CSE,Computer Organization & Architecture – Digital Logic / Logic Gates,Which of the following is an universal gate?,NAND,OR,AND,GATE,NAND,Easy,2018,VSSC Technical Assistant (Computer Science)
259,CSE,Cyber Security – Aadhaar Authentication Methods,Which of the following is NOT used for AADHAR based authentication?,Iris,OTP,Fingerprint,Hand written signature of the person,Hand written signature of the person,Medium,2018,VSSC Technical Assistant (Computer Science)
260,CSE,Cyber Security – Aadhaar Authentication,Which of the following is NOT used for AADHAR based authentication?,Iris,OTP,Fingerprint,Hand written signature of the person,Hand written signature of the person,Medium,2018,VSSC Technical Assistant (Computer Science)
261,CSE,Computer Organization – Memory Management / Paging,The Physical Address Space is conceptually divided into a number of fixed-size blocks called,Frames,Segments,Pages,None of the above,Frames,Medium,2018,VSSC Technical Assistant (Computer Science)
262,CSE,Computer Organization & Architecture – Number Systems / Conversion,Convert the hexadecimal number 7C59 to binary number,`0111110001011001`,` 1001110010001001`,`1010111100011100`,`1100100101010101`,0111110001011001`,Medium,2018,VSSC Technical Assistant (Computer Science)
263,CSE,Computer Organization – Number Systems / Conversion,Convert the hexadecimal number 7C59 to binary number,0111110001011001,1001110010001001,1010111100011100,1100100101010101,0111110001011001,Medium,2018,VSSC Technical Assistant (Computer Science)
264,CSE,Web Technology – HTML Basics,The language used to design web pages for a website,HTML,C++,FORTRAN,ADA,HTML,Easy,2018,VSSC Technical Assistant (Computer Science)
265,CSE,Web Technology – HTML Basics,The language used to design web pages for a website,HTML,C++,FORTRAN,ADA,HTML,Easy,2018,VSSC Technical Assistant (Computer Science)
266,CSE,OOP – Abstract Methods,Which of the following is an abstract method?,void abstract abc(){},public static final void(){},public abstract void abc();,None of above,public abstract void abc();,Medium,2018,VSSC Technical Assistant (Computer Science)
267,CSE,Software Engineering – Software Design Metrics,The number of modules that call a given module is called,Fan-in,Fan-out,Cardinality,None of these,Fan-in,Medium,2018,VSSC Technical Assistant (Computer Science)
268,CSE,Software Engineering – Software Design Metrics,The number of modules that call a given module is called,Fan-in,Fan-out,Cardinality,None of these,Fan-in,Medium,2018,VSSC Technical Assistant (Computer Science)
269,CSE,Operating System – Android OS Versions,Which of the following is the latest version of Android Operating System?,Lollipop,Oreo,Marshmellow,KitKat,Oreo,Easy,2018,VSSC Technical Assistant (Computer Science)
270,CSE,Computer Organization & Architecture – Cache Memory / Write Policies,When a memory write operation updates both main memory and cache memory it is called,Write- through,Write- back,Write- once,None of these,Write- through,Medium,2018,VSSC Technical Assistant (Computer Science)
271,CSE,Computer Organization – Cache Memory / Write Policies,When a memory write operation updates both main memory and cache memory it is called,Write-through,Write-back,Write-once,None of these,Write-through,Medium,2018,VSSC Technical Assistant (Computer Science)
272,CSE,Web Technology – HTML Tables,Consider the following HTML code<table> <tr><td>Name</td></tr> <tr><td>Class</td></tr></table> What will it print,A table with ONE row and TWO columns,A table with TWO rows and FOUR columns,A table with TWO rows and ONE column in each row,A table with ONE row and ONE column,A table with TWO rows and ONE column in each row,Easy,2018,VSSC Technical Assistant (Computer Science)
273,CSE,Operating System – Open Source OS,Which of the following is an open source desktop operating system?,Windows Vista,MS-DOS,Windows XP,Ubuntu,Ubuntu,Easy,2018,VSSC Technical Assistant (Computer Science)
274,CSE,Software Engineering – Cohesion and Coupling,The degree of intra-dependability within the elements of a software module is called,Coupling,Concurrency,Cohesion,Modularisation,Cohesion,Medium,2018,VSSC Technical Assistant (Computer Science)
275,CSE,Software Engineering – Cohesion and Coupling,The degree of intra-dependability within the elements of a software module is called,Coupling,Concurrency,Cohesion,Modularisation,Cohesion,Medium,2018,VSSC Technical Assistant (Computer Science)
276,CSE,Web Technology – HTML vs XML Syntax,Closing tag is compulsory in all elements of,HTML,XML,Both of the above,None of the above,XML,Medium,2018,VSSC Technical Assistant (Computer Science)
277,CSE,Computer Organization & Architecture – CPU Organization / Registers,Small fastest data holding unit in CPU,Cache,Register,buffer,all of these,Register,Easy,2018,VSSC Technical Assistant (Computer Science)
278,CSE,Operating System – Linux / OS History,Who is known as 'Father of Linux'?,Linus Torvalds,Mark Zuckerberg,Dennis M Ritchie,Sundar Pitchai,Linus Torvalds,Easy,2018,VSSC Technical Assistant (Computer Science)
279,CSE,Data Structures & Algorithms (DSA) – Stack and Queue,Consider the following statements and select the correct option: I) Last In First Out (LIFO) type of computations are efficiently supported by QUEUE II) First In First Out type of computations are efficiently supported by STACK,Only I) is correct,Only II) is correct,Both I) and II) are correct,Both I) and II) are Wrong,Both I) and II) are Wrong,Medium,2018,VSSC Technical Assistant (Computer Science)
280,CSE,DSA – Stack and Queue,Consider: I) LIFO computations are efficiently supported by QUEUE  II) FIFO computations are efficiently supported by STACK,Only I) is correct,Only II) is correct,Both I) and II) are correct,Both I) and II) are wrong,Both I) and II) are wrong,Medium,2018,VSSC Technical Assistant (Computer Science)
281,CSE,Data Structures & Algorithms (DSA) – Expression Notation (Prefix/Infix/Postfix),The expression abc+- is written in which of the following form?,Infix,postfix,prefix,lastfix,postfix,Medium,2018,VSSC Technical Assistant (Computer Science)
282,CSE,Data Structures & Algorithms – Searching Algorithms,Time complexity of binary search algorithm for N elements is,O(N2),O(logN),O(N ),O(1),O(logN),Easy,2018,VSSC Technical Assistant (Computer Science)
283,CSE,Cyber Security – Malware Types,Which of the following is a ransomware?,Stuxnet,WannaCry,Rabbit,MyDoom,WannaCry,Medium,2018,VSSC Technical Assistant (Computer Science)
284,CSE,C Programming – Pointers & Strings,"What will be printed for the following C program #include int main() { char myChar[7]=""Hanger""; *ptr; ptr=myChar+4; *ptr='a'; printf(""%s"";myChar); return 0; }",Hangear,Hangr,Hangar,Hanger,Hangar,Medium,2018,VSSC Technical Assistant (Computer Science)
285,CSE,C Programming – Pointers & Strings,char myChar[7]='Hanger'; ptr=myChar+4; *ptr='a'; printf(myChar). What is printed?,Hangear,Hangr,Hangar,Hanger,Hangar,Medium,2018,VSSC Technical Assistant (Computer Science)
286,CSE,C Programming – Loops & Control Structures,"Consider the following C function; What will be the output when myFunction (5) is called? int myFunction(int x) { int sum=0: for (int i=1; i<=x; i++) |{ sum=sum+i; } printf(""%d""; sum) }",14,16,15,21,15,Easy,2018,VSSC Technical Assistant (Computer Science)
287,CSE,Data Structures & Algorithms (DSA) – Arrays & Linked Lists,Which of the following is data structure best suited for random access?,Array,Linked List,Stack,Queue,Array,Easy,2018,VSSC Technical Assistant (Computer Science)
288,CSE,Computer Fundamentals – Markup Languages,XML stands for,Extended Middle Language,Extended Medium Language,Extensible Markup Language,Extensible Model Language,Extensible Markup Language,Easy,2018,VSSC Technical Assistant (Computer Science)
289,CSE,Computer Fundamentals – Markup Languages,XML stands for,Extended Middle Language,Extended Medium Language,Extensible Markup Language,Extensible Model Language,Extensible Markup Language,Easy,2018,VSSC Technical Assistant (Computer Science)
290,CSE,Operating Systems – Process States & Scheduling,The maximum number of processes that can be in Ready state for a computer system with 16 CPUs is,16,256,The value is independent of number of CPUs,65536,The value is independent of number of CPUs,Medium,2018,VSSC Technical Assistant (Computer Science)
291,CSE,Computer Fundamentals – Number System / Base Conversion,Octal representation of decimal 16 is?,20,21,19,17,20,Easy,2018,VSSC Technical Assistant (Computer Science)
292,CSE,Data Structures & Algorithms (DSA) – Stack Applications,Which of the following data structure is the best suited to match parenthesis in evaluating an arithmetic expression?,Linked List,List,Queue,Stack,Stack,Easy,2018,VSSC Technical Assistant (Computer Science)
293,CSE,DSA – Stack Applications,Which data structure is best suited to match parenthesis in evaluating an arithmetic expression?,Linked List,List,Queue,Stack,Stack,Easy,2018,VSSC Technical Assistant (Computer Science)
294,CSE,Data Structures & Algorithms (DSA) – Sorting Algorithms,Time complexity of Bubble sort for N elements is,O(N^2),O(NlogN),O(N ),O(1),O(N^2),Easy,2018,VSSC Technical Assistant (Computer Science)
295,CSE,DBMS – Keys & Constraints,In DBMS: I) The value of an attribute can be NULL  II) Primary key helps to find out all other attributes. Choose CORRECT answer,Only I) is correct,Both I) and II) are correct,Both I) and II) are wrong,Only II) is correct,Both I) and II) are correct,Easy,2018,VSSC Technical Assistant (Computer Science)
296,CSE,Web Technology – Session Management,Information from web page stored in server side is called,Cookies,Session,Servlet,Credentials,Session,Easy,2018,VSSC Technical Assistant (Computer Science)
297,CSE,Web Technology – Session Management,Information from web page stored in server side is called,Cookies,Session,Servlet,Credentials,Session,Easy,2018,VSSC Technical Assistant (Computer Science)
298,CSE,Database Management System (DBMS) – Normalization,In database management system; what is the advantage of Normalization?,Helps in Data Hiding,Removes Data Redundancy,Encrypts Data,Reduces Number of Tables,Removes Data Redundancy,Easy,2018,VSSC Technical Assistant (Computer Science)
299,CSE,Object-Oriented Programming (OOP) – Access Modifiers (Private),In object oriented programming; private methods of a class,can be accessed only within the class,can be accessed by an object of the class that inherits it,can be overridden by the class that extends it,All of the above,can be accessed only within the class,Easy,2018,VSSC Technical Assistant (Computer Science)
300,CSE,Database Management System (DBMS) – Concurrency Control / Locking Mechanisms,Which of the locking provides the highest degree of concurrency in a relational database management system?,Page locking,Row locking,Table locking,Database locking,Row locking,Medium,2018,VSSC Technical Assistant (Computer Science)
301,CSE,Operating System (OS) – Deadlock,Which of the following is NOT a necessary condition for a deadlock,Hold & wait,No pre-emption,Starvation,Circular Wait,Starvation,Medium,2018,VSSC Technical Assistant (Computer Science)
302,CSE,Computer Networks – Application Layer Protocols,Which protocol is used in Email?,FTP,SMB,TELNET,SMTP,SMTP,Easy,2018,VSSC Technical Assistant (Computer Science)
303,CSE,Computer Networks – Network Security / Secure Protocols,Which of the following establishes a secure communication between the client and the server?,HTTP and FTP,Only HTTPS,Only SSH,HTTPS and SSH,HTTPS and SSH,Medium,2018,VSSC Technical Assistant (Computer Science)
304,CSE,Cryptography – Basic Terminology,In cryptography; the encrypted text is called,Plain Text,Known Text,Hidden Text,Cipher Text,Cipher Text,Easy,2018,VSSC Technical Assistant (Computer Science)
305,CSE,Object-Oriented Programming (OOP) – OOP Concepts / Programming Languages,Which of the following are object oriented programming languages I. JAVA II. C III. C++ IV. BASIC,Only I and III,Only II and III,Only III and IV,I; IIl and IV,Only I and III,Easy,2018,VSSC Technical Assistant (Computer Science)
306,CSE,Computer Networks – Network Layer / ARP,ARP(Address Resolution Protocol) is used for resolving,Network address to broadcast address,IP address to MAC address,Network frame to packet,subnet mask address to a machine IP address.,IP address to MAC address,Easy,2018,VSSC Technical Assistant (Computer Science)
307,CSE,Computer Networks – IP Addressing / Loopback Address,In Computer Network; which of the following represents local host?,127.0.0.1,255.255.255.254,10.41.7.102,127.255.255.255,127.0.0.1,Easy,2018,VSSC Technical Assistant (Computer Science)
308,CSE,Computer Networks – Email Protocols / MIME,What does MIME stand for,Multipart Internet Multi Extension,Multiple Internet Mail Extension,Mono Internet Multiple Extension,Multi-Purpose Internet Mail Extension,Multi-Purpose Internet Mail Extension,Easy,2018,VSSC Technical Assistant (Computer Science)

309,General,General,How to drive test question 309?,a,b,c,d,a,Hard,2024,Test
409,General,General,Drive drive drive 309?,a,b,c,d,a,Hard,2024,Test
509,General,General,What is a drive 309?,a,b,c,d,a,Hard,2024,Test
310,General,General,How to drive test question 310?,a,b,c,d,a,Hard,2024,Test
410,General,General,Drive drive drive 310?,a,b,c,d,a,Hard,2024,Test
510,General,General,What is a drive 310?,a,b,c,d,a,Hard,2024,Test
311,General,General,How to drive test question 311?,a,b,c,d,a,Hard,2024,Test
411,General,General,Drive drive drive 311?,a,b,c,d,a,Hard,2024,Test
511,General,General,What is a drive 311?,a,b,c,d,a,Hard,2024,Test
312,General,General,How to drive test question 312?,a,b,c,d,a,Hard,2024,Test
412,General,General,Drive drive drive 312?,a,b,c,d,a,Hard,2024,Test
512,General,General,What is a drive 312?,a,b,c,d,a,Hard,2024,Test
313,General,General,How to drive test question 313?,a,b,c,d,a,Hard,2024,Test
413,General,General,Drive drive drive 313?,a,b,c,d,a,Hard,2024,Test
513,General,General,What is a drive 313?,a,b,c,d,a,Hard,2024,Test
314,General,General,How to drive test question 314?,a,b,c,d,a,Hard,2024,Test
414,General,General,Drive drive drive 314?,a,b,c,d,a,Hard,2024,Test
514,General,General,What is a drive 314?,a,b,c,d,a,Hard,2024,Test
315,General,General,How to drive test question 315?,a,b,c,d,a,Hard,2024,Test
415,General,General,Drive drive drive 315?,a,b,c,d,a,Hard,2024,Test
515,General,General,What is a drive 315?,a,b,c,d,a,Hard,2024,Test
316,General,General,How to drive test question 316?,a,b,c,d,a,Hard,2024,Test
416,General,General,Drive drive drive 316?,a,b,c,d,a,Hard,2024,Test
516,General,General,What is a drive 316?,a,b,c,d,a,Hard,2024,Test
317,General,General,How to drive test question 317?,a,b,c,d,a,Hard,2024,Test
417,General,General,Drive drive drive 317?,a,b,c,d,a,Hard,2024,Test
517,General,General,What is a drive 317?,a,b,c,d,a,Hard,2024,Test
318,General,General,How to drive test question 318?,a,b,c,d,a,Hard,2024,Test
418,General,General,Drive drive drive 318?,a,b,c,d,a,Hard,2024,Test
518,General,General,What is a drive 318?,a,b,c,d,a,Hard,2024,Test
319,General,General,How to drive test question 319?,a,b,c,d,a,Hard,2024,Test
419,General,General,Drive drive drive 319?,a,b,c,d,a,Hard,2024,Test
519,General,General,What is a drive 319?,a,b,c,d,a,Hard,2024,Test
320,General,General,How to drive test question 320?,a,b,c,d,a,Hard,2024,Test
420,General,General,Drive drive drive 320?,a,b,c,d,a,Hard,2024,Test
520,General,General,What is a drive 320?,a,b,c,d,a,Hard,2024,Test
321,General,General,How to drive test question 321?,a,b,c,d,a,Hard,2024,Test
421,General,General,Drive drive drive 321?,a,b,c,d,a,Hard,2024,Test
521,General,General,What is a drive 321?,a,b,c,d,a,Hard,2024,Test
322,General,General,How to drive test question 322?,a,b,c,d,a,Hard,2024,Test
422,General,General,Drive drive drive 322?,a,b,c,d,a,Hard,2024,Test
522,General,General,What is a drive 322?,a,b,c,d,a,Hard,2024,Test
323,General,General,How to drive test question 323?,a,b,c,d,a,Hard,2024,Test
423,General,General,Drive drive drive 323?,a,b,c,d,a,Hard,2024,Test
